{
  "schema_version": "slot-alignment.metric-targets.v6",
  "task_id": "<task-id>",
  "frozen_before_candidate": true,
  "targets": {
    "N1.total_rtp.overall": {
      "target_status": "available",
      "value": 0.96,
      "source": {
        "method": "user_confirmed_exact_rtp",
        "confirmation_type": "confirmed_by_user",
        "confirmation_evidence_sha256": "<sha256>"
      }
    }
  }
}
